news_headline,news_article,news_category
Trifecta Capital seeks approval for $200mn late-stage VC fund,Trifecta Capital said it has filed for SEBI approval for a $200 million late-stage venture capital fund for new economy companies that are likely to go public in the next one-three years. Trifecta Leaders Fund-I will invest $15-30 million each in 10 companies for minority stakes through a combination of primary and secondary positions. ,startup
"GAIL India to invest in startups, calls for proposals","Government-owned GAIL (India) has said it will invest in startups through its initiative 'Pankh'. It has opened a fresh round for solicitation of investment proposals from startups operating in identified focus areas. These areas include natural gas, petrochemicals, energy, project management, bio-manure marketing, nano materials, IoT, data mining, environment, health and social, it said.",startup
Australian rapper Iggy shares X-rated texts she gets from celebrities on Instagram ,"Australian rapper Iggy Azalea has shared X-rated messages she gets from celebrities on Instagram. She also revealed that a celebrity offered her $15,000 cash just to speak with her. ""I want to kiss the inside of your b**t h**e,"" read one message from an account with 27 million followers. One of the messages showed a celebrity offering to marry her.",entertainment
"Roadies fame model-actor Sakib Khan quits showbiz, says 'Surrendering before Allah'","Roadies fame model-actor Sakib Khan has decided to quit showbiz to follow the religious path. Sharing pictures on Instagram, he wrote, ""I won't be doing any modelling and acting in future...I was going astray (gumrah) and was going against my [tenets] of Islam. I used to offer Namaz but something was lacking...Now I [am] totally surrendering before Allah."" 
",entertainment
"Man asks woman for Instagram handle at protest in US, she turns out to be Rihanna","During a Stop Asian Hate march in New York City on Monday, a man who wanted to tag Rihanna in a photo approached her to ask for her Instagram handle without realising who she was. Without saying anything, the singer politely obliged. After looking at the account, the man turned and asked, ""That's you?!"" after which Rihanna burst out laughing.",entertainment
Hansal shares pic of 25-yr-old son with Down Syndrome after govt's remark on vaccine,"Filmmaker Hansal Mehta shared a picture of his son Pallava. ""[He] is 25...He has [Down] Syndrome. He...suffered from a near-fatal respiratory failure...few years ago. Does he want the vaccine or does he need it?"" Hansal wrote. Government recently said ""the aim is not to administer COVID-19 vaccine to those who want it but to those who need it.""",entertainment
"After Vicky Kaushal, rumoured girlfriend Katrina tests positive for COVID-19","Katrina Kaif on Tuesday shared that she has tested COVID-19 positive. ""Have immediately isolated myself and will be under home quarantine. I'm following all safety protocols under the advice of my doctors. Requesting everyone who came in contact with me to get tested immediately too,"" she wrote. This comes after rumoured boyfriend Vicky Kaushal tested positive for the virus.
",entertainment
"Actress Snehil spots Ronaldo on her visit to Serbia, shares video with DDLJ dialogue","Actress Snehil Dixit Mehra took to Instagram to reveal she spotted footballer Cristiano Ronaldo at a hotel in Serbia. She shared a Reel on Instagram wherein she can be heard saying Dilwale Dulhania Le Jayenge's 'Palat' dialogue. ""Agar ye mujhe pyaar karta hai toh palat kar jarur dekhega. Palat. Palat. Palat,"" she says. ""Lucky,"" a follower commented on her video.",entertainment
"I had 2 miscarriages, didn't have my partner by my side: Mahima","In an interview with Bollywood Bubble, actress Mahima Chaudhry revealed that she had two miscarriages when she was married to Bobby Mukherji. She also said that her husband was not by her side during the difficult time. Mahima, who married Mukherji in 2006 and got divorced in 2013, has a daughter from her marriage. ",entertainment
'Chernobyl' actor Paul Ritter passes away due to brain tumour,"Paul Ritter, known for shows like 'Chernobyl' and 'Friday Night Dinner', died of a brain tumour on Monday. The actor, who was in his 50s, passed away at home with his family by his side, his agent said. Paul made his acting debut in 1992 and appeared in films like 'Harry Potter and the Half-Blood Prince' and 'Quantum of Solace'.",entertainment
"Govt must offer subsidies, tax rebates for theatres' revival: Suniel ","Actor Suniel Shetty talked about the Maharashtra government's decision to shut theatres again amid the surge in COVID-19 cases and said that the government needs to offer subsidies and tax rebates to the single-screen theatres and multiplexes for their revival. ""Theatres need our [industry's] support with good content, and also need the government and the audience’s support,"" he added. ",entertainment
"Renuka Shahane, Ashutosh Rana, Shefali Shah receive COVID-19 vaccine","Actors Ashutosh Rana, Renuka Shahane and Shefali Shah have received the first dose of the coronavirus vaccine. Taking to Twitter on Tuesday, Renuka shared a picture of herself with Ashutosh and thanked the doctors and nurses for their services. Meanwhile, Shefali shared a ""side effects song"" penned by make-up artist Pallavi Symons and urged everyone to get vaccinated. ",entertainment
'Mortal Kombat' to release in India on April 23,"The release date of the action-adventure film 'Mortal Kombat', starring Lewis Tan and Josh Lawson, has been pushed forward by a week in India. The film, which was supposed to release on April 16, will now hit the theatres on April 23. Directed by Simon McQuoid, 'Mortal Kombat' will release in English, Hindi, Tamil and Telugu across cinemas in India.",entertainment
I've lost another friend: Sharmila after Soumitra's wife's demise,"Actress Sharmila Tagore mourned the demise of Soumitra Chatterjee's wife Deepa Chatterjee, who passed away on Sunday in Kolkata. ""I knew Deepa through Soumitra at first and then became close to her...We shared a rapport separate from Soumitra,"" she said, adding, ""She came home on a number of occasions. It was always a pleasure to meet her...I've lost another friend.""",entertainment
"Taapsee Pannu completes 8 years in Bollywood, shares post","Actress Taapsee Pannu has completed eight years in Bollywood and to mark the occasion, the actress shared a collage of all her movies on her Instagram Story. Alongside the collage, Taapsee wrote, ""Eight years since I saw myself speaking in my mother tongue on screen."" Taapsee made her Bollywood debut with David Dhawan's 2013 comedy-drama 'Chashme Baddoor'.",entertainment
Waiting for my turn: Kangana as parents receive COVID-19 vaccine,"Kangana Ranaut took to Twitter on Wednesday to share that her parents have received the second dose of the COVID-19 vaccine. ""No fever no weakness no other symptoms they are feeling quite good and happy,"" she wrote while sharing a picture of them from a vaccination centre in Himachal Pradesh. ""Waiting for my turn now,"" Kangana further wrote. ",entertainment
Hello Charlie is one-of-a-kind story never been told before: Aadar,"Actor Aadar Jain, while speaking about his upcoming comedy film 'Hello Charlie', said, ""It's a one-of-a-kind story never been told before, with a gorilla."" ""It is a family film made to make you laugh, feel good, and special,"" he added. ""I hope they all connect with it and give it a chance because it's a special film,"" Aadar further said. ",entertainment
"After Regé-Jean's exit, 'Bridgerton' season 2 adds 4 new actors ","Actors Charithra Chandran, Shelley Conn, Calam Lynch and Rupert Young will join the second season of 'Bridgerton', according to Variety. The news of the casting comes days after it was revealed that actor Regé-Jean Page won't return for the new season. Chandran will play Edwina Sharma, Conn will play Mary Sharma and Lynch will portray Theo Sharpe, as per reports.",entertainment
Jacqueline Fernandez to star in action-thriller film Dia: Reports,"Jacqueline Fernandez will reportedly star in an action-thriller film, which will be produced by Bhushan Kumar. Tentatively titled 'Dia', the film will be shot in London in the month of June, after she completes the shoot of 'Ram Setu', reports said. ""The shoot dates may however change depending on the COVID scenario in India as well as abroad,"" reports stated. ",entertainment
I've spent too many years counting calories: Chrissy on diet culture,"Model Chrissy Teigen, while talking about giving up diet mentality, said, ""I've spent way too many years counting calories."" In her latest cover story with People, the 35-year-old stated that it's more important for her to enjoy things as they come. ""I eat things when I want them. Because if I don't my mind personally goes crazy,"" Teigen added. ",entertainment
"H'wood's stunt choreographer Andy Long joins Vijay, Ananya's Liger","Hollywood stunt choreographer Andy Long, who has worked in films like 'Robin Hood' and 'Dragon Blade', has joined the team of Ananya Panday and Vijay Deverakonda's upcoming film 'Liger'. Karan Johar took to Instagram Stories to share the news and wrote, ""Some action-packed moves are on the way."" The film is being directed by Puri Jagannadh.",entertainment
 I finally feel old and settled: Rana Daggubati on married life ,"Actor Rana Daggubati, while talking about his married life with wife Miheeka Bajaj, said, ""Married life is treating me good. I finally feel old and settled."" The actor also spoke about how the pandemic has changed the entertainment industry and stated, ""Today it’s no longer about mediums so much but more about the quality of content."" ",entertainment
